Title,Desc,Type,BodyPart,Equipment,Level,Rating
Dumbbell Bench Press,"The dumbbell bench press is a mainstay of workout enthusiasts worldwide. It’s a classic move for building a bigger, stronger chest. As such, it’s often placed first in mass-building chest workouts.",Strength,Chest,Dumbbell,Intermediate,9.2
Dumbbell Flyes,"The dumbbell chest fly is a popular exercise that targets the pectoral or chest muscles. It attempts to isolate the chest muscles, stretching and contracting them while limiting involvement of the shoulders. Unlike a press, where the elbows bend and flex, flyes should keep a relatively consistent elbow angle. The motion is sometimes compared to ""hugging a tree."" Dumbbell flyes are usually performed for moderate to high reps, such as 8-12 reps per set or more, as part of a chest or upper-body focused workout.",Strength,Chest,Dumbbell,Intermediate,9.1
Incline dumbbell bench press,"The incline dumbbell bench press is a popular upper-body exercise targeting the upper pectoral muscles. While it can be a strength-focused movement, it is usually performed for moderate to high reps, such as 8-12 reps per set or more, as part of upper-body or chest-focused training.",Strength,Chest,Dumbbell,Intermediate,9.1
Decline Dumbbell Flyes,"The decline dumbbell chest fly is an upper body isolation exercise targeting the lower chest. It will require less weight than a decline press, which makes it a great hypertrophy exercise with high reps.",Strength,Chest,Dumbbell,Intermediate,9.0
Reverse-grip incline dumbbell bench press,"The reverse-grip incline dumbbell bench press is an upper-body exercise targeting the pectoral muscles. Pressing with a reverse grip targets the upper chest in particular, especially when performed on an incline. This press variation is usually performed for moderate to high reps, such as 8-12 reps per set or more, as part of upper-body or chest-focused training.",Strength,Chest,Dumbbell,Beginner,8.9
Incline Dumbbell Flyes,"The incline dumbbell chest fly is an upper body isolation exercise targeting the upper chest and is typically used with aesthetic goals in mind. It will require less weight than an incline press, which makes it a great hypertrophy exercise with high reps.",Strength,Chest,Dumbbell,Intermediate,8.8
Neutral-grip dumbbell bench press,"The neutral-grip dumbbell bench press is a variation on a classic chest-building exercise where the palms face each other instead of forward. This shift puts the elbows closer to the sides, placing more emphasis on the triceps, and perhaps also the inner chest. The neutral-grip press can be performed in lower reps for strength or higher reps for muscle growth.",Strength,Chest,Dumbbell,Intermediate,8.7
Bodyweight Flyes,"The double-bar roll-out chest fly is a chest exercise that utilizes two rotating barbells as ""handles"" for a chest fly. It targets the muscles of the chest, but is also an intense core workout. It's a tough movement that is usually performed in the chest-focused portion of a workout.",Strength,Chest,E-Z Curl Bar,Beginner,9.0
Close-grip EZ-bar bench press,"The close-grip EZ-bar bench press is an exercise targeting the chest, shoulders, and triceps. This move is more commonly done with a straight bar and is often only performed with an EZ-bar as part of a complex of movements such as pull-overs or skullcrushers.",Strength,Chest,E-Z Curl Bar,Intermediate,8.8
Chest dip,"The chest dip is a bodyweight exercise performed on parallel bars or on a pull-up and dip station. It targets the chest, triceps, and shoulders. Dips with a chest focus are usually performed with the torso leaning forward and the elbows angled out from the torso. Dips can be performed for low reps for strength or higher reps for muscle growth.",Strength,Chest,Other,Intermediate,9.0
Palms-down wrist curl over bench,"The palms-down wrist curl over bench is an exercise targeting the forearms. It is usually performed for high reps, such as 10-15 reps per set or more, as part of a grip or arm-focused workout.",Strength,Forearms,Barbell,Intermediate,9.5
Palms-up wrist curl over bench,"The palms-up wrist curl over bench is an exercise targeting the forearms. It is usually performed for high reps, such as 10-15 reps per set or more, as part of a grip or arm-focused workout.",Strength,Forearms,Barbell,Intermediate,9.4
Standing behind-the-back wrist curl,"The standing behind-the-back wrist curl is a popular exercise to target the muscles in the forearms, wrists, and fingers. It is generally performed for moderate to high reps, such as 8-15 reps per set, and can work as isolated forearm training or as part of an arms-focused workout.",Strength,Forearms,Barbell,Beginner,9.3
Seated finger curl,"The seated finger curl is an exercise targeting the muscles of the hands and forearms. It is popular with rock climbers and other athletes looking to build forearm size and strength. The range of motion is tiny, but done for moderate to high reps, these will definitely make the forearms burn.",Strength,Forearms,Barbell,Beginner,9.3
Seated palms-up wrist curl,"The seated palms-up wrist curl is an exercise targeting the forearms. It is usually performed for high reps, such as 10-15 reps per set or more, as part of a grip or arm-focused workout.",Strength,Forearms,Barbell,Intermediate,8.7
Dumbbell farmer's walk,"The dumbbell farmer's walk is an exercise with roots in competitive strongman training, but which is also popular in CrossFit and functional training. It can be a challenging finisher to any workout, or work well in fat-loss circuit training or as an accessory movement to heavy lifts like the deadlift.",Strongman,Forearms,Other,Intermediate,9.4
Barbell glute bridge,"The barbell glute bridge is a popular exercise targeting the muscles of the glutes and hamstrings. It can be done as a strength movement on its own, as an activation drill or warm-up for lower-body training, or as a burnout at the end of a lower-body workout.",Powerlifting,Glutes,Barbell,Intermediate,9.4
Barbell Hip Thrust,"The barbell hip thrust is an exercise that engages the posterior chain, particular the glutes. It involves fully extending your hips while holding a weighted barbell across the midsection.",Powerlifting,Glutes,Barbell,Intermediate,9.1
Single-leg cable hip extension,"The single-leg cable hip extension is an isolation exercise that targets the glutes, specifically the gluteus maximus. It is a common burnout movement on a lower-body focused day and is usually performed for moderate to high reps, such as 8-12 reps per set or more.",Strength,Glutes,Cable,Intermediate,9.0
Glute bridge,"The glute bridge is a popular lower-body bodyweight exercise that primarily targets the glutes, but also activates the lower back and hamstrings. It can be performed with body weight alone, or with added resistance such as barbells, dumbbells, or bands. It can be performed for time or reps and works perfectly in a dynamic warm-up for lower-body training, but can also be performed for glute activation anytime.",Strength,Glutes,Body Only,Intermediate,8.8
Single-leg glute bridge,"The single-leg glute bridge is a lower-body exercise that targets the glutes, lower back, and hamstrings. It is performed one side at a time.",Strength,Glutes,Body Only,Intermediate,8.8
Step-up with knee raise,"The step-up with knee raise is a lower-body exercise targeting the quads, glutes, and hamstrings. It differs from a traditional step-up in that at the top, you lift the trailing leg up to full hip flexion. This gives the exercise a greater range of motion and more of a focus on powerful hip extension in the working leg. When performed with body weight, these are usually performed for high reps as part of a dynamic warm-up, as cardio acceleration, or as part of the lower-body portion of a workout or circuit.",Strength,Glutes,Body Only,Intermediate,8.7
Barbell Deadlift,"The barbell deadlift is a compound exercise used to develop overall strength and size in the posterior chain. It is a competition lift in the sport of powerlifting, but is also considered a classic benchmark of overall strength. When performed with the hands outside the knees, it is often called a ""conventional"" deadlift. When the feet are wide and the hands are inside the knees, it is a sumo deadlift.",Strength,Hamstrings,Barbell,Intermediate,9.4
Sumo deadlift,"The sumo deadlift is a compound movement in which the feet are set in a wide stance with toes pointed out and grip is placed inside of the legs. It is allowed to be performed instead of conventional deadlifts in most powerlifting competitions. The sumo deadlift targets the hamstrings, glutes, and upper back/traps, but also has a greater emphasis on stretching and strengthening the adductor and hip muscles due to the wide stance.",Powerlifting,Hamstrings,Barbell,Beginner,9.3
Power clean,"The power clean is a full-body movement in which the bar is pulled from the floor and caught in the front rack position in three pulls or phases. The bar is received in the ""power"" position, with the hips higher than a full-depth squat position. The power clean can be used as a component of the clean and press or clean and jerk, but is also a valuable lift to build explosive power and strength.",Strength,Hamstrings,Barbell,Intermediate,8.7
Kettlebell pass-through lunge,"The kettlebell pass-through lunge is a dynamic leg and core exercise in which a lifter passes a weight under their front leg during lunges. It is a unique coordination challenge, but also challenging to the musculature of the abdomen, lower body, shoulders, and upper back. It is most commonly performed for higher reps, such as 10-15 reps per side, or for time. It can work in circuit-style workouts, or in lower-body or full-body time-efficient training.",Strength,Hamstrings,Kettlebells,Intermediate,8.7
Romanian Deadlift With Dumbbells,"The dumbbell stiff-legged deadlift targets the hamstrings, glutes, low and upper back, as well as the core. The purpose of the stiff-legged, as opposed to Romanian deadlift with slightly bent knees, is to engage the hamstrings and low back to an even greater degree.",Strength,Hamstrings,Dumbbell,Beginner,9.4
Stiff-Legged Dumbbell Deadlift,"The dumbbell stiff-legged deadlift targets the hamstrings, glutes, low and upper back, as well as the core. The purpose of the stiff-legged, as opposed to Romanian deadlift with slightly bent knees, is to engage the hamstrings and low back to an even greater degree.",Strength,Hamstrings,Dumbbell,Intermediate,8.8
Lying Leg Curls,"The lying leg curl is a popular machine-based exercise for the legs, particularly the hamstrings. It is similar to the seated leg curl, but the open hip angle in the lying leg curl may incorporate more glute and calf activation. It is usually performed for moderate to high reps, such as 8-12 reps per set or more, as part of a leg pre-exhaust or as a muscle-building movement for lower-body training.",Strength,Hamstrings,Machine,Beginner,8.9
Natural Glute Ham Raise,The glute ham raise is an exercise targeting the glutes and hamstrings on a GHD.,Strength,Hamstrings,Body Only,Beginner,9.1
Exercise ball leg curl,"The exercise ball leg curl is an exercise targeting the hamstrings. In particular, it targets the knee flexion function of the hamstrings, as opposed to deadlift variations, which target the other hamstring function, hip flexion. Many lifters opt for this exercise when they don't have access to a lying leg curl machine, but it is worth considering even if you already do machine curls.",Strength,Hamstrings,Exercise Ball,Intermediate,8.8
Weighted pull-up,"The weighted pull-up is a more advanced variation of the pull-up exercise in which the lifter adds extra weight to their body. Options for adding weight include a dip belt, weighted vest, chains, a dumbbell placed between the feet or legs, or looping a kettlebell over the foot. Like other pull-up variations, the weighted pull-up builds strength and muscle in the upper back, biceps, and core.",Strength,Lats,Other,Intermediate,9.5
Close-grip pull-down,"The close-grip pull-down is a variation on the lat pull-down that is performed with an overhand grip and the hands slightly closer than shoulder-width apart. This increases the range of motion beyond wider grips, and may increase the time under tension in each rep. This variation is usually performed for moderate to high reps as part of a back or upper-body workout.",Strength,Lats,Cable,Intermediate,8.9
Shotgun row,"The shotgun row is a single-arm row variation utilizing a cable stack in a staggered stance. It targets the muscles of the middle back, like the lats (latissimus dorsi) and rhomboids, but also the core. It is usually performed for moderate to high-reps, at least 8-15 reps per set, in the later stages of a back or upper-body workout.",Strength,Lats,Cable,Intermediate,8.9
Close-Grip Front Lat Pulldown,"The close-grip pull-down is a variation on the lat pull-down, acable-based exercise machine that’s ubiquitous in gyms around the world. This back builder is easy to learn and highly effective, allowing for variable resistance depending on where you place the pin in the stack.",Strength,Lats,Cable,Intermediate,8.8
Straight-arm rope pull-down,"The straight-arm rope pull-down is a variation of the straight-arm lat pull-down performed using a cable stack machine and a rope grip. It can either be performed in an athletic upright stance, or slightly bent over. It both stretches and contracts the muscles of the lats (latissimus dorsi) as well as providing additional activation to the other upper back muscles and the core. Because the triceps are also isometrically involved in the movement, it is usually performed for higher reps, such as 8-15 reps or more.",Strength,Lats,Cable,Intermediate,8.7
Pullups,"The pull-up is a multi-joint bodyweight exercise that builds strength and muscle in the upper back, biceps, and core. It is often used as a measurement tool in military or tactical fitness tests, and is an excellent gauge of “relative strength” which is strength in relation to bodyweight.",Strength,Lats,Body Only,Intermediate,9.2
Pull-up,"The pull-up is a multijoint bodyweight exercise that builds strength and muscle in the upper back, biceps, and core. It is often used as a measurement tool in military or tactical fitness tests, and is an excellent gauge of ""relative strength"" which is strength in relation to body weight.",Strength,Lats,Body Only,Beginner,8.9
Rope climb,"The rope climb is an exercise that is used commonly in CrossFit workouts and as a test of upper-body strength. It was even contested at the Olympics in the early 20th century. It targets a wide range of upper-body musculature, including the hands and forearms, shoulders, biceps, lats (latissimus dorsi), and core.",Strength,Lats,Body Only,Intermediate,8.7
Barbell deficit deadlift,"The barbell deficit deadlift is a compound exercise targeting the posterior chain. It is commonly utilized in powerlifting training to build pulling strength off the floor, but is also an effective muscle-building movement for the glutes and hamstrings. It is usually performed with lighter weight, and perhaps for higher reps, than traditional deadlifts. If these make your back sore, decrease the deficit and/or wear a weightlifting belt.",Powerlifting,Lower Back,Barbell,Beginner,9.4
Back extension,"The back extension is an exercise used to build lower back strength that also targets the hamstrings and glutes. It is often performed on a 45-degree bench with the feet anchored. Unweighted back extensions are often performed for high reps, such as 15-20 reps or more, but the movement can also be performed with added weight in lower rep ranges, such as 8-12 reps per set.",Strength,Lower Back,Body Only,Intermediate,9.1
Reverse-grip bent-over row,"The reverse-grip bent-over row is a compound exercise used to build strength and size in both the lower and upper back. It targets nearly all of the muscles in the back, but particularly the lats, rhomboids, and lower back. It is thought to target the biceps and lats a bit more directly than overhand barbell rows. Because it can be loaded heavily, it is a popular movement in strength and muscle-focused upper-body workouts.",Strength,Middle Back,Barbell,Intermediate,9.2
One-Arm Long Bar Row,"The single-arm landmine bent-over row is a barbell exercise focused on the muscles of the middle back, such as the lats (latissimus dorsi) and rhomboids. It also targets the biceps and grip. It utilizes a landmine device which anchors one end of the barbell near the ground, but could also be approximated by placing the barbell in the corner of a room.",Strength,Middle Back,Barbell,Intermediate,9.0
Bent Over Barbell Row,"The barbell bent-over row is a compound exercise used to build strength and size in both the lower and upper back. It targets nearly all of the muscles in the back, but particularly the lats, rhomboids, and lower back. It is commonly utilized as an accessory movement for the deadlift in powerlifting, but is also popular in strength and muscle-focused upper-body workouts.",Strength,Middle Back,Barbell,Intermediate,8.7
One-Arm Dumbbell Row,"The single-arm bench dumbbell row is a popular exercise for building the latissimus dorsi, or lat, muscles of the back. The bench is used for support during the rowing motion.",Strength,Middle Back,Dumbbell,Intermediate,9.0
Incline dumbbell row,"The incline dumbbell row is an upper-body exercise targeting the lats (latissimus dorsi) and upper-back muscles, as well as the biceps. Performing it on an incline bench helps target the lower lats in particular. Dumbbell row variations are usually performed for moderate to high reps, such as 8-12 reps per set or more, as part of the upper-body or back-focused portion of a workout.",Strength,Middle Back,Dumbbell,Intermediate,8.8
Alternating sit-through with crunch,"The alternating sit-through with crunch is a full-body movement that starts in a bear crawl position and ends with a leg kicked out to the side. In between reps, you perform a crunch. It is commonly performed for reps or time in bodyweight circuits and animal-style flows, but can also work on its own or as part of a dynamic warm-up or mobility sequence.",Strength,Middle Back,Other,Intermediate,8.9
Seated Cable Rows,"The cable seated row is a popular exercise to train the muscles of the upper back, including the lats (latissimus dorsi), traps, rhomboids, and rear deltoids, using a cable stack. It also targets the biceps to a lesser degree. The cable row can work well in a variety of rep-ranges, but is most popular in muscle-building workouts or as an accessory movement for strength workouts.",Strength,Middle Back,Cable,Intermediate,8.8
Upside-down pull-up,"The upside-down pull-up is an advanced bodyweight exercise that is normally performed on a pair of gymnastic rings. It involves pulling the body toward the ceiling in an inverted position. It targets the same muscles as traditional pull-ups, including the lats (latissimus dorsi), biceps, and core. However, the pulling angle is more akin to a bent-over row or upright row, depending on the angle of your hips.",Strength,Middle Back,Other,Intermediate,8.8
Seated Cable Rows,"The cable seated row is a popular exercise to train the muscles of the upper back, including the lats (latissimus dorsi), traps, rhomboids, and rear deltoids, using a cable stack. It also targets the biceps to a lesser degree. The cable row can work well in a variety of rep-ranges, but is most popular in muscle-building workouts or as an accessory movement for strength workouts.",Strength,Middle Back,Cable,Intermediate,8.8
Rower,"The rower is a popular gym machine that is serious cardiovascular work, but also targets the legs, back, and arm muscles. It's a great way build overall aerobic and muscular fitness. It is popular in CrossFit-style workouts, but is also a staple in all types of gyms. It can be equally effective for HIIT-style interval workouts or for longer-duration endurance work.",Cardio,Middle Back,Machine,Intermediate,8.9
Seated Cable Rows,"The cable seated row is a popular exercise to train the muscles of the upper back, including the lats (latissimus dorsi), traps, rhomboids, and rear deltoids, using a cable stack. It also targets the biceps to a lesser degree. The cable row can work well in a variety of rep-ranges, but is most popular in muscle-building workouts or as an accessory movement for strength workouts.",Strength,Middle Back,Cable,Intermediate,8.8
Kettlebell sumo deadlift high pull,"The kettlebell sumo deadlift high pull is a dynamic kettlebell exercise that focuses on the muscles of the posterior chain, including the hamstrings, glutes, traps, rear delts, and upper back. It can be done in lower reps for power or strength, or higher reps for conditioning and fat loss. It can also be a component of a circuit-style kettlebell workout, either for time or reps.",Strength,Traps,Kettlebells,Intermediate,8.7
Standing dumbbell shrug,"The standing dumbbell shrug is a popular movement to build and strengthen the trapezius muscles. It's often trained on a bodybuilding-style shoulder or back training day, but can also work well in full-body or strength-focused training.",Strength,Traps,Dumbbell,Intermediate,8.7
Standing dumbbell upright row,"The standing dumbbell upright row is a popular movement for building stronger and bigger traps and shoulders. Many lifters combine this move with either their back or shoulder workout, since it involves both body parts. It is generally performed for moderate to high reps, such as 8-12 reps per set or more.",Strength,Traps,Dumbbell,Intermediate,8.7
Smith machine shrug,"The Smith machine shrug is an upper-body exercise targeting the traps (trapezius muscles). It is usually performed for moderate to high reps, such as 8-12 reps per set or more, as part of shoulder or trap-focused training.",Strength,Traps,Machine,Intermediate,9.2
Single-leg depth squat,"The single-leg depth squat is an exercise targeting the muscles of the lower body, including the quads, glutes, and hamstrings. It is sometimes used as a substitute for the pistol squat, since it doesn't demand the same level of flexibility to perform. It is usually performed for low to moderate reps with a focus on proper form and control.",Strength,Quadriceps,Bands,Intermediate,9.0
Barbell Full Squat,"The barbell back squat is a popular compound movement that emphasizes building the lower-body muscle groups and overall strength. It's the classic way to start a leg day, and is a worthy centerpiece to a lower-body training program. The squat is a competitive lift in the sport of powerlifting, but is also a classic measurement of lower-body strength. With the barbell racked on the traps or upper back, the emphasis is placed on the posterior chain but the entire body gets worked. The back squat can be trained in everything from heavy singles to sets of 20 reps or higher.",Strength,Quadriceps,Barbell,Intermediate,9.4
Barbell back squat to box,"The barbell back squat to box is a popular version of a classic lower-body exercise that utilizes a box at the bottom position of the movement. This allows the lifter to customize the depth of the squat, as well as limit the stretch reflex at the bottom of the squat. The movement targets the quadriceps, glutes, and hamstrings. The squat to box can be performed for low reps to build strength or power, or for higher reps to build muscle.",Powerlifting,Quadriceps,Barbell,Intermediate,9.3
Push-press,"The push-press is an overhead press variation in which the barbell is pushed upward with assistance from the lower body. This ""push"" helps the weight travel through the sticking point of a strict press. The push-press is commonly performed as part of barbell complexes, power training for all types of athletics, or as a powerful shoulder exercise.",Olympic Weightlifting,Quadriceps,Barbell,Intermediate,9.3
Power snatch-,"The power snatch is a full-body lift in which the bar is pulled from the floor with a wide grip to the overhead position in one movement. The bar is received in the ""power"" position, with the hips higher than a full-depth squat position. The power snatch can be used as a learning tool for the full snatch, or to train muscular power and strength on its own. It is usually performed for low reps, focusing on power and movement quality.",Olympic Weightlifting,Quadriceps,Barbell,Expert,9.3
Barbell walking lunge,"The barbell walking lunge tests your ability to maintain balance while challenging the quads, glutes, and hamstrings as well as the core muscles. Using a barbell allows you to overload the exercise. It can be performed for moderate reps, such as 8-15 per set or across the gym, or for higher reps as a conditioning and mental toughness challenge.",Strength,Quadriceps,Barbell,Intermediate,9.2
Narrow-stance squat,"The narrow-stance squat is an exercise that targets the lower body with an emphasis on the quads. Many people will find they can't go as deep in a narrow-stance squat as with a wider squat, which is normal. The narrow-stance squat can be performed for time or reps in any workout.",Strength,Quadriceps,Barbell,Expert,9.0
Barbell Squat,"The barbell back squat is a popular compound movement that emphasizes building the lower-body muscle groups and overall strength. It's the classic way to start a leg day, and is a worthy centerpiece to a lower-body training program. The squat is a competitive lift in the sport of powerlifting, but is also a classic measurement of lower-body strength. With the barbell racked on the traps or upper back, the emphasis is placed on the posterior chain but the entire body gets worked. The back squat can be trained in everything from heavy singles to sets of 20 reps or higher.",Strength,Quadriceps,Barbell,Intermediate,8.9
