Title,Desc,Type,BodyPart,Equipment,Level,Rating
Barbell roll-out,"The barbell roll-out is an abdominal exercise that utilizes a barbell in the place of an ab roller. It is best performed with a barbell that has rotating collars, and is considered more difficult than other ab roller variations. Many lifters may not be able to perform a single rep at first, but once they can perform these for reps, they'll be rewarded with a seriously strong core.",Strength,Abdominals,Barbell,Intermediate,8.9
Barbell Ab Rollout - On Knees,"The barbell roll-out is an abdominal exercise that utilizes a barbell in the place of an ab roller. It is best performed with a barbell that has rotating collars, and is considered more difficult than other ab roller variations. Many lifters may not be able to perform a single rep at first, but once they can perform these for reps, they'll be rewarded with a seriously strong core.",Strength,Abdominals,Barbell,Intermediate,8.9
Dumbbell V-Sit Cross Jab,"The dumbbell V-sit cross jab is a hybrid movement that trains the abdominal and shoulder muscles simultaneously. It can address multiple muscle groups in a time-efficient muscle-building or circuit-style workout, while also providing a cardiovascular challenge.",Strength,Abdominals,Dumbbell,Intermediate,9.3
Dumbbell spell caster,"The dumbbell spell caster is an exercise that primarily targets the abdominal muscles such as the obliques. However, it also works shoulders, back, hips, and legs, and demands all of those muscles work together in a coordinated motion. It is usually performed with relatively light weights for moderate to high reps, at least 8-12 reps per side. Make sure to only use a weight you can control.",Strength,Abdominals,Dumbbell,Beginner,9.3
Landmine twist,"The landmine twist is a rotational abdominal movement performed using an angled barbell anchored at floor level in a landmine device. It can also be performed by sticking a barbell in the corner of a room, preferably in a towel to protect the walls. It targets the deep muscles of the core, including both the obliques and the transversus abdominis. It can be done fast or slow, for time or reps, either in traditional muscle-focused rep ranges such as 8-12 reps per side or for higher rep ranges.",Strength,Abdominals,Other,Intermediate,9.5
Suspended ab fall-out,"The suspended ab fall-out is a dynamic abdominal exercise utilizing a suspension strap system or gymnastic rings. It is similar in form to an ab roller, but can more easily be scaled to be more or less difficult. It targets the muscles of the rectus abdominis or ""six-pack"" muscles, as well as the deep core muscles. It can be trained for low reps for strength or higher reps for muscle definition.",Strength,Abdominals,Other,Intermediate,9.3
Decline reverse crunch,"The decline reverse crunch is a popular bodyweight exercise targeting the abdominal muscles, particularly the lower abs. It is usually performed for high reps, such as 10-15 reps per set or more, as part of the ab-focused portion of a workout.",Strength,Abdominals,Other,Intermediate,9.2
Weighted Crunches,"The weighted suitcase crunch is a weighted version of a popular abdominal training exercise. The simple addition of a weight makes the suitcase crunch far more difficult, helping build the ""six pack"" muscles and providing a different stimulus to the core during training.",Strength,Abdominals,Other,Intermediate,8.9
Ab Roller,"The ab wheel roll-out is an exercise targeting the abdominals, often with an inexpensive wheel device with a handle on either side. Many trainers and strength coaches claim it's one of, if no the best exercise for developing strength in the midsection. Beginners may have to start with a limited range of motion or just wheel planks.",Strength,Abdominals,Other,Intermediate,8.9
Otis-Up,"The Otis-up is a weighted exercise focusing on the abdominal muscles, as well as the shoulders to a lesser degree. It primarily targets the rectus abdominus or “six-pack” muscles, but also involves the obliques and deep core muscles. It is normally performed on a decline bench holding a weight plate, but can also be performed with a dumbbell, kettlebell, or other weight.",Strength,Abdominals,Other,Intermediate,8.8
Standing cable low-to-high twist,"The standing cable low-to-high twist is a core exercise targeting the upper abdominals and the obliques. Take care to perform it with control, as opposed to violent twisting which can injure the back. It is usually performed for moderate to high reps, at least 8-15 per side, as part of the core-focused portion of a workout.",Strength,Abdominals,Cable,Intermediate,9.3
Single-arm high-cable side bend,The single-arm high-cable side bend is an exercise targeting the obliques using a cable stack machine.,Strength,Abdominals,Cable,Intermediate,9.1
Kneeling cable oblique crunch,"The kneeling cable oblique crunch is a popular core isolation exercise using a rope attachment and cable stack while kneeling on the floor. It primarily targets the obliques and rectus abdominis or ""six-pack"" muscles, but also strengthens the deep core muscles. It is most commonly performed for moderate to high reps, such as 8-12 reps per set or higher.",Strength,Abdominals,Cable,Intermediate,9.0
Kneeling cable crunch,"The kneeling cable crunch is a popular core isolation exercise using a rope attachment and cable stack while kneeling on the floor. It primarily targets the rectus abdominis or ""six-pack"" muscles, but also strengthens the deep core muscles. It is most commonly performed early in an ab workout, usually in moderate to high reps, such as 8-12 reps per set or higher.",Strength,Abdominals,Cable,Intermediate,8.9
Elbow plank,"The elbow plank is a popular isometric abdominal exercise. It is common in all types of exercise programs, as well as in group fitness and yoga classes. It targets the muscles of the core, the deep core or transversus abdominis in particular. It is also often prescribed for time to help back pain or to teach proper bracing.",Strength,Abdominals,Body Only,Intermediate,9.3
Bottoms Up,"The lying leg lift is a popular bodyweight exercise targeting the muscles of the abs, the rectus abdominis or “six-pack” muscles in particular. It can be performed for time or reps in the core-focused portion of any workout.",Strength,Abdominals,Body Only,Intermediate,9.3
Spider crawl,"The spider crawl is a bodyweight exercise that involves crawling on the floor with the knees outside of the elbows. It is different from a leopard crawl in that the hips are higher, and it's different from a bear crawl because the knees are wider. It can be done as a full-body warm-up, in short bursts for power or circuit training, or for longer durations as cardiovascular conditioning.",Strength,Abdominals,Body Only,Intermediate,9.2
Cocoons,"The cocoon crunch is a bodyweight exercise targeting the ab muscles, the rectus abdominis or ""six-pack"" muscles in particular. It involves bringing your knees to your chest and your arms from overhead to center. It can be performed for time or reps as part of the ab-focused portion of any workout.",Strength,Abdominals,Body Only,Intermediate,9.1
Cross-Body Crunch,"The elbow-to-knee crunch is a bodyweight exercise targeting the ab muscles, the obliques and rectus abdominis or ""six-pack"" muscles in particular. It can be performed for time or reps as part of the ab-focused portion of any workout.",Strength,Abdominals,Body Only,Intermediate,9.1
Elbow-to-knee crunch,"The elbow-to-knee crunch is a bodyweight exercise targeting the ab muscles, the obliques and rectus abdominis or ""six-pack"" muscles in particular. It can be performed for time or reps as part of the ab-focused portion of any workout.",Strength,Abdominals,Body Only,Intermediate,9.1
Decline Crunch,The decline crunch is an effective core exercise targeting the rectus abdominis.,Strength,Abdominals,Body Only,Intermediate,9.0
Hanging toes-to-bar,"The hanging toes-to-bar is an advanced abdominal exercise in which the lifter touches their feet to a pull-up bar. There are many ways to perform this movement (strict or swinging, arms completely straight or slightly bent, legs straight or bent) each providing unique benefits and challenges. Initially, it may be a difficult move to do for a single rep, but once you build the requisite core, lat, and shoulder strength, it can be performed for higher reps.",Strength,Abdominals,Body Only,Intermediate,9.0
Hanging Oblique Knee Raise,"The hanging oblique crunch an abdominal exercise that targets both the rectus abdominus or “six-pack” muscles, and the oblique muscles. It can be performed hanging from a bar, or if grip strength is a limitation, by placing the elbows in ab straps. If hanging from a straight bar is uncomfortable to the wrists or shoulder, you can also perform them hanging with a neutral grip (palms facing one another)",Strength,Abdominals,Body Only,Intermediate,9.0
Hanging leg raise,"The hanging leg raise is an exercise targeting the abs, but which also works the lats and hip flexors. Instead of resting your forearms on the pads of a captain's chair, you perform these hanging from a bar. Experienced lifters make these look easy, but beginners may need time to build up to sets of 8-12 reps.",Strength,Abdominals,Body Only,Intermediate,8.9
Mountain climber,"The mountain climber is a popular bodyweight exercise targeting the muscles of the core, as well as the shoulders, hips, and cardiovascular system. It involves lifting one knee to the chest at a time from a straight-arm plank position. It can be performed for time or reps as part of a dynamic warm-up, for bodyweight cardio or conditioning, or as no-equipment dynamic core training.",Plyometrics,Abdominals,Body Only,Intermediate,8.8
Ab bicycle,"The ab bicycle is a bodyweight movement that targets the muscles of the abs, the obliques and rectus abdominis or ""six-pack"" muscles in particular. It can be performed for time or reps in the ab-focused portion of any workout.",Strength,Abdominals,Body Only,Intermediate,8.8
3/4 sit-up,"The 3/4 sit-up is a bodyweight exercise focused on the muscles of the core. It is similar to a sit-up, but stops short of the top position. This keeps constant tension on the abs, making it more difficult than traditional sit-ups. It can be performed for time or for reps, with the feet anchored or free, as part of the ab-focused portion of any workout.",Strength,Abdominals,Body Only,Intermediate,8.8
Reverse crunch,"The reverse crunch is a popular exercise targeting the abdominals, particularly the lower half. It’s easy to perform on either the floor or a flat bench. Many lifters think of this as a companion to the crunch, which targets the upper abdominals more than the lower.",Strength,Abdominals,Body Only,Intermediate,8.8
Crunches,"The crunch is a popular core exercise targeting the rectus abdominis, or ""six-pack"" muscles, as well as the obliques. It has been the centerpiece of many ab-focused workouts, due to both its simplicity and the intense burn and mind-muscle connection it produces. It can be performed for time or reps as part of the ab-focused portion of any workout.",Strength,Abdominals,Body Only,Intermediate,8.7
Dumbbell suitcase crunch,"The dumbbell suitcase crunch is a weighted version of a popular abdominal training exercise. The simple addition of a weight makes the suitcase crunch far more difficult, helping build the ""six pack"" muscles and providing a different stimulus to the core during training.",Strength,Abdominals,Medicine Ball,Intermediate,9.0
Exercise Ball Pull-In,The exercise ball knee roll-in is an abdominal exercise that involves supporting yourself with your hands in a plank or push-up position and drawing the knees in toward the chest. This is a fairly advanced abdominal move requiring core strength.,Strength,Abdominals,Exercise Ball,Intermediate,8.9
Thigh adductor,"The thigh adductor machine is a lower-body exercise that targets the muscles of the inner thighs. It is usually performed for moderate to high reps, such as 8-12 reps per set or more, as part of lower-body training.",Strength,Adductors,Machine,Intermediate,9.0
Wide-grip barbell curl,"The wide-grip barbell curl is a variation of the classic barbell curl with the grip wider than shoulder width. It is thought that this helps build the inner or ""short"" head of the biceps muscles. This movement is usually performed for moderate to high reps, such as 8-12 reps per set.",Strength,Biceps,Barbell,Beginner,9.3
EZ-bar spider curl,"The EZ-bar spider curl is an exercise targeting the biceps and performed face down on either an incline bench or on the flat side of a preacher bench. The EZ-bar makes for a more comfortable wrist position, while the angle helps to isolate the biceps and limit involvement of the shoulder muscles. This curl variation is usually performed for moderate to high reps, such as 8-12 reps per set or more, as part of upper-body or arm-focused training.",Strength,Biceps,Barbell,Intermediate,9.2
Barbell Curl,"The barbell curl is an arm exercise that is also one of the most recognizable movements in all of bodybuilding and fitness. It helps build sleeve-popping biceps and allows heavier loading than many other curl variations. It is usually performed in moderate to high reps, such as 8-12 reps per set, as part of the arm-focused portion of any workout.",Strength,Biceps,Barbell,Intermediate,9.0
Close-grip EZ-bar curl,"The close-grip EZ-bar curl is an exercise targeting the biceps, particularly the long head. The main difference between this exercise and standard EZ-bar curls is that the hands are positioned closer together on the bar. It is thought that this helps build the outer biceps head and the peak. This curl variation is usually performed for moderate to high reps, such as 8-12 reps per set.",Strength,Biceps,Barbell,Beginner,8.9
Preacher Curl,"The EZ-bar preacher curl is a classic exercise for building bigger biceps. This move is all about isolation. With the back of the upper arms against the pad, it’s next to impossible to cheat. Go light, get a great pump, and build that peak!",Strength,Biceps,Barbell,Intermediate,8.8
Hammer Curls,"This curl is performed simultaneously with dumbbells but without wrist supination. Throughout each rep, the wrists remain neutral, like a carpenter hammering a nail.",Strength,Biceps,Dumbbell,Intermediate,9.1
Biceps curl to shoulder press,"The biceps curl to shoulder press is a dumbbell complex that combines two exercises that build and strengthen the biceps and shoulders or deltoids. It is usually performed one rep of each movement at a time, although you could perform more reps of each, or increase the reps in successive rounds (e.g., 1 rep in round 1, 2 reps in round 2, etc.). No matter how you structure the sets and reps, it is a time-efficient way to hit two crucial upper-body muscles in any workout.",Strength,Biceps,Dumbbell,Beginner,9.1
Concentration curl,"The concentration curl is a classic exercise for building the biceps one arm at a time. It can be performed bent over or kneeling, but is more often performed seated on a bench. It's great for emphasizing the biceps peak and is often used to finish a biceps workout. Like most curl variations, these are usually performed for moderate to high reps, such as 8-12 reps per set or more.",Strength,Biceps,Dumbbell,Intermediate,9.0
Dumbbell Bicep Curl,"The dumbbell biceps curl is a single-joint exercise for building bigger and stronger biceps. Popular among gym goers of all experience levels, this move can be done seated or standing. It is generally performed for moderate to high reps, such as 8-12 reps or higher, as part of the arm-focused portion of a workout.",Strength,Biceps,Dumbbell,Intermediate,8.9
Cross-body hammer curl,"The cross-body hammer curl is a dumbbell exercise that targets the biceps, brachialis, and forearm muscles. Rather than lifting the weights directly in front of the body, you lift them across the torso. Throughout each rep, the wrists remain neutral, like a carpenter hammering a nail. This helps isolate the brachialis muscles on each arm. It is generally performed for moderate to high reps, such as 8-12 reps or more, as part of the arm-focused portion of a workout.",Strength,Biceps,Dumbbell,Beginner,8.9
Dumbbell Alternate Bicep Curl,"The alternating biceps curl is a single-joint exercise for building bigger and stronger biceps one arm at a time. Popular among gym goers of all experience levels, this move can be done seated or standing. It is generally performed for moderate to high reps, such as 8-12 reps or higher, as part of the arm-focused portion of a workout.",Strength,Biceps,Dumbbell,Intermediate,8.7
Single-arm dumbbell preacher curl,"The single-arm dumbbell preacher curl is an exercise that focuses on building the biceps, particularly the biceps peak. Most people will go light on this movement, performing it for moderate to high reps as part of an upper-body or arms-focused workout.",Strength,Biceps,Dumbbell,Intermediate,8.7
Alternate Incline Dumbbell Curl,"The alternating incline dumbbell biceps curl is an exercise targeting the biceps and performed face up on an incline bench. This creates a vertical arm angle which helps to isolate the biceps and limit involvement of the shoulder muscles. This curl variation is usually performed for moderate to high reps, such as 8-12 rep per arm or more, as part of upper-body or arm-focused training.",Strength,Biceps,Dumbbell,Intermediate,8.7
Standing concentration curl,"The standing concentration curl is a variation on the more common seated concentration curl, which is a staple of bodybuilding arm routines. It can serve as a substitute for preacher curl variations if a preacher bench is unavailable and is also a classic way to focus in on the biceps peak. It is usually performed for moderate to high reps, such as 8-10 reps per set, with a focus on strict form and controlled tempo.",Strength,Biceps,Dumbbell,Beginner,8.7
Overhead cable curl,"Also known as a crucifix curl, the overhead cable curl is a biceps-focused exercise performed between two cable stacks, using a pair of D-handles. The arms and elbows are held at shoulder height throughout the movement, and both hands curl in toward the ears. This position is designed to eliminate shoulder involvement and momentum, while targeting the biceps peak. This movement is generally done for moderate to high reps, such as 8-12 reps per set or more, as part of arm-focused training.",Strength,Biceps,Cable,Intermediate,9.0
Standing One-Arm Cable Curl,The single-arm cable biceps curl is a single-joint isolation exercise for building the biceps. This move is intended to be strict and deliberate; this is not an exercise for using momentum or otherwise cheating.,Strength,Biceps,Cable,Beginner,8.8
EZ-Bar Curl,"The standing EZ-bar curl is an immensely popular exercise targeting the biceps. It is commonly performed for moderate to high reps as part of an upper body or arms-focused workout. Many gyms even have EZ-bars at fixed weights, allowing for easy weight changes.",Strength,Biceps,E-Z Curl Bar,Intermediate,9.1
Reverse Barbell Preacher Curls,"The reverse-grip barbell curl is a variation on the biceps curl where the palms face downward. The switch from an underhand to an overhand grip brings the forearm and brachialis muscles more into the exercise. If it is uncomfortable to the wrists, try performing it on the angles of an EZ-curl bar.",Strength,Biceps,E-Z Curl Bar,Beginner,8.8
Smith Machine Calf Raise,"The Smith machine standing calf raise is a machine-based exercise targeting the muscles of the calves, particularly the gastrocnemius or upper calf muscle. It is usually performed for moderate to high reps, such as 8-12 reps per set or more, as part of the lower-body portion of a workout.",Strength,Calves,Machine,Intermediate,9.2
Standing Calf Raises,"The standing calf raise is a popular movement to target the calf muscles of the lower leg, and in particular the gastrocnemius muscles. When unweighted, it is usually performed for high reps or for time.",Strength,Calves,Machine,Beginner,9.0
Seated Calf Raise,"The machine seated calf raise is an exercise targeting the calf muscles of the lower leg, particularly the soleus muscle. It is usually performed for moderate to high reps, such as 8-12 reps per set, and occasionally for very high burnout-focused sets of 50-100 total reps.",Strength,Calves,Machine,Intermediate,8.7
Calf Press On The Leg Press Machine,"The leg press calf raise is an exercise that uses the leg press machine to work the calves. With the toes and balls of your feet on the platform but heels off, you push forward to work the calves.",Strength,Calves,Machine,Intermediate,8.7
Close-grip bench press,"The close-grip bench press is a popular exercise targeting the triceps and chest. The main difference between this exercise and the standard bench press is that the hands and elbows are placed closer together, which places more of an emphasis on the triceps. The close-grip bench press is often used as an accessory movement for the traditional bench press, or as a triceps builder for arm training. Similar to the bench press, it can be trained in low reps for strength or higher reps for muscle or strength endurance.",Strength,Chest,Barbell,Intermediate,9.1
Barbell Bench Press - Medium Grip,"The bench press is a compound exercise that builds strength and muscle in the chest and triceps. When many people think of listing, the bench press is often the first exercise that comes to mind",Strength,Chest,Barbell,Intermediate,9.0
Decline barbell bench press,"The decline barbell bench press is a popular upper-body exercise targeting the lower pectoral muscles. While it can be a strength-focused movement, it is usually performed for moderate to high reps, such as 8-12 reps per set or more, as part of upper-body or chest-focused training.",Strength,Chest,Barbell,Intermediate,8.9
Wide-grip bench press,"The wide-grip bench press is a compound exercise targeting the chest and, to a lesser extent, the triceps. The main difference between this exercise and the standard bench press is that the hands are placed farther apart on the bar. Many lifters find they can handle more weight going wide than with narrower grips, although it's also worth noting that plenty of banged-up lifters have said benching with a wide grip may also have contributed to their shoulder injuries and pain. The wide-grip bench is often used as a chest-building movement in chest or upper-body workouts, or as an accessory movement for the traditional bench press.",Strength,Chest,Barbell,Beginner,8.9
Barbell Incline Bench Press Medium-Grip,The incline bench press is an upper body compound movement that targets the upper chest.,Strength,Chest,Barbell,Intermediate,8.8
Pushups,"The push-up is a popular bodyweight exercise that is commonly used in military and tactical physical fitness tests. It’s a classic movement to build upper-body muscle and strength, emphasizing the chest, triceps, and shoulders, but also working the upper back and core.",Strength,Chest,Body Only,Intermediate,9.2
Incline Push-Up,"The hands-elevated push-up is a variation on the push-up, a body-weight standard. The hands are elevated, so that your body is aligned at an angle to the floor rather than parallel.",Strength,Chest,Body Only,Intermediate,8.8
Hands-elevated push-up,"The hands-elevated push-up is a variation on the classic push-up where the hands are placed on a bench or other elevated surface. Having the hands higher than the feet makes it easier than push-ups on the floor, but also puts the emphasis more on the triceps. It can be used as a substitute for floor push-ups or as a mechanical dropset after maxing out on floor push-ups.",Strength,Chest,Body Only,Beginner,8.7
Low-cable cross-over,"The low-cable cross-over is an isolation movement that uses a cable stack to target the upper portion of the pectoral muscles. It is common in upper-body and chest-focused muscle-building workouts, often in combination with presses or flyes from other angles to target all portions of the chest.",Strength,Chest,Cable,Intermediate,9.1
Incline cable chest fly,"The incline cable chest fly is an isolation movement that uses a cable stack and an incline bench to target the upper portion of the pectoral muscles. It is common in upper-body and chest-focused muscle-building workouts, often after pressing movements like the barbell or dumbbell bench press or as a finishing movement at the end of the workout. It is often used in combination with other flyes to target the chest from different angles.",Strength,Chest,Cable,Intermediate,9.0
Cable Crossover,"The cable cross-over is an isolation movement that uses a cable stack to build bigger and stronger pectoral muscles. Since it's done using adjustable pulleys, you can target different parts of your chest by setting the pulleys at different levels. It is common in upper body and chest-focused muscle-building workouts, often as a pre-exhaust at the beginning of a workout, or a finishing movement at the end. It is often in combination with other presses or flyes to target the chest from different angles.",Strength,Chest,Cable,Intermediate,8.8
Incline cable chest press,"The incline cable chest press is a pressing movement that uses a cable stack and an incline bench to target the upper portion of the pectoral muscles, similar to an incline dumbbell press. It is common in upper-body and chest-focused muscle-building workouts, where it can be effective as a primary movement in classic hypertrophy rep ranges, as a pre-exhaust, or as a high-rep finisher. It is often used in combination with other presses or flyes to target the chest from different angles.",Strength,Chest,Cable,Beginner,8.7
