Title,Desc,Type,BodyPart,Equipment,Level,Rating
Behind-the-head skullcrusher,"The behind-the-head skullcrusher is a variation on a triceps exercise that has been a staple of bodybuilders for decades. In this version, instead of the bar coming down lightly to the forehead, the bar tracks over the top of the head without touching it. Skullcrushers are usually performed for moderate to high reps, such as 8-12 reps per set or more, as part of an upper-body or arm-focused workout. If a straight bar is uncomfortable for your wrists or elbows, try using an angled EZ-bar.",Strength,Triceps,Barbell,Intermediate,8.7
Dumbbell floor press,"The dumbbell floor press is a multijoint pressing exercise performed lying on the floor. It can be performed either with the knees bent or flat. The floor press limits the range of motion you would achieve with a regular dumbbell bench press, but still targets the chest, triceps, and anterior delts. This allows you to press more weight than in a dumbbell bench press, and perhaps put less stress on the shoulders.",Powerlifting,Triceps,Dumbbell,Intermediate,9.3
Seated triceps press,"The seated triceps press is a popular arm-building exercise that targets the triceps with a single dumbbell held by both hands, extending it up behind your head. While you can go surprisingly heavy on this movement, it is usually performed for moderate to high reps, such as 8-12 reps per set or more, as part of the upper-body or arm-focused portion of a workout. If you're going heavy, having someone help get the weight into position is a good idea.",Strength,Triceps,Dumbbell,Intermediate,8.9
Tricep Dumbbell Kickback,The single-arm triceps kick-back is an isolation move from a bent-over position used to increase size and strength of the triceps.,Strength,Triceps,Dumbbell,Intermediate,8.8
Double-arm triceps kick-back,"The double-arm triceps kick-back is a popular movement to increase size and strength of the triceps. It is usually performed for moderate to high reps, at least 8-12 reps, as part of an upper-body or arm-focused workout.",Strength,Triceps,Dumbbell,Intermediate,8.8
Cable V-bar push-down,"The cable V-bar push-down is a popular gym exercise for targeting the triceps. It utilizes an angled bar, which can allow you to move heavier weights more comfortably than a straight bar or rope. It is usually performed for moderate to high reps, such as 8-12 reps or more per set, as part of an upper-body or arm-focused workout.",Strength,Triceps,Cable,Intermediate,9.1
Reverse Grip Triceps Pushdown,"The reverse-grip cable straight-bar push-down is a twist on the popular cable straight-bar push-down. The difference has to do with how the hands are positioned holding the bar: the palms facing up rather than down. Because grip will be a limiting factor, this movement is usually performed for moderate to high reps, such as 8-12 reps per set or higher.",Strength,Triceps,Cable,Intermediate,9.0
Kneeling cable triceps extension,The kneeling cable triceps extension is a single-joint exercise meant to isolate the triceps muscles using a high pully on a cable stack and a bench. It can also be performed in a tall-kneeling stance from a low pully. It is most commonly used in muscle-building triceps or arm workouts.,Strength,Triceps,Cable,Intermediate,9.0
Single-arm cable triceps extension,"The single-arm cable triceps extension is a single-joint isolation exercise for building the triceps. It involves driving a handle attached to a cable stack overhead to full extension. It is usually performed for moderate to high reps, such as 8-12 reps per set or more, as part of an upper-body or arm-focused workout.",Strength,Triceps,Cable,Intermediate,8.9
Dip Machine,"The dip machine is a machine exercise that mimics a triceps dip, a bodyweight exercise performed on parallel bars or on a pull-up and dip station. It targets the triceps first, but also stretches and strengthens the chest and shoulders. Dips with a triceps focus are usually performed with an upright torso, the knees bent and crossed, and the arms close to the body. Dips can be performed for low reps for strength or higher reps for muscle growth.",Strength,Triceps,Cable,Intermediate,8.8
Triceps dip,"The triceps dip is a bodyweight exercise performed on parallel bars or on a pull-up and dip station. It targets the triceps first, but also stretches and strengthens the chest and shoulders. Dips with a triceps focus are usually performed with an upright torso, the knees bent and crossed, and the arms close to the body. Dips can be performed for low reps for strength or higher reps for muscle growth.",Strength,Triceps,Body Only,Intermediate,9.4
Weighted bench dip,The weighted bench dip is a highly effective exercise for building the triceps. The resistance comes from a combination of body weight and added weight—usually a weight plate.,Strength,Triceps,Body Only,Intermediate,9.1
Push-Ups - Close Triceps Position,"The close push-up is an upper-body exercise that targets the chest, triceps, and shoulders. The close hand position places more emphasis on the triceps.",Strength,Triceps,Body Only,Intermediate,9.0
Parallel Bar Dip,"The triceps dip is a bodyweight exercise performed on parallel bars or on a pull-up and dip station. It targets the triceps first, but also stretches and strengthens the chest and shoulders. Dips with a triceps focus are usually performed with an upright torso, the knees bent and crossed, and the arms close to the body. Dips can be performed for low reps for strength or higher reps for muscle growth.",Strength,Triceps,Body Only,Intermediate,8.8
Ring dip,"The ring dip is an upper-body strength exercise performed on gymnastic rings. It targets the muscles of the chest, triceps, and shoulders, but is also quite taxing to the core. It is generally considered to be more difficult than dips performed on parallel bars. It is common in gymnastics training and CrossFit workouts, but is also a simple way to make dips more challenging for any strength athlete.",Strength,Triceps,Body Only,Intermediate,8.8
Feet-elevated bench dip,"The feet-elevated bench dip is a popular bodyweight exercise for building the triceps, chest, and shoulders. Elevating the feet brings more chest and shoulder into the movement, but also allows for extra weight on the hips. If these bother your shoulders, try performing them between two benches or chairs rather than on a single bench.",Strength,Triceps,Body Only,Intermediate,8.7
Decline EZ-bar skullcrusher,"The decline EZ-bar skullcrusher is a popular exercise targeting the triceps muscles. The angle of the bench creates a greater range of motion than flat bench skullcrushers, as well as targeting the lateral head of the muscle. This exercise is usually performed for moderate to high reps as part of an upper-body or arm-focused workout.",Strength,Triceps,E-Z Curl Bar,Intermediate,9.3
EZ-Bar Skullcrusher,"The EZ-bar skullcrusher is a popular exercise targeting the triceps muscles. The EZ-bar is used more often than a straight bar. As for the name, that’s worst-case scenario. The bar should actually come down behind the head. It is usually performed for moderate to high reps as part of an upper body or arms-focused workout. No need to chase a 1RM on this move!",Strength,Triceps,E-Z Curl Bar,Intermediate,9.0
